<?xml version = '1.0' encoding = 'UTF-8'?>
<ns2:FindCustomersRs xmlns:ns2="http://soa.grupovidanta.com/CustomerTestBiz" xmlns:xsi="http://www.w3.org/2001/XMLSchema-instance" xsi:schemaLocation="http://soa.grupovidanta.com/CustomerTestBiz file:/home/marco/jdeveloper/SOAEnvironmentTest/CustomerTestBiz/xsd/CustomerTestBiz.xsd">
   <ns2:Success/>
   <ns2:Customers>
      <ns2:Customer>
         <ns2:BasicInformation>
            <ns2:ID>1</ns2:ID>
            <ns2:Name>Name2</ns2:Name>
            <ns2:LastName>LastName3</ns2:LastName>
            <ns2:MiddleName>MiddleName4</ns2:MiddleName>
            <ns2:Gender>Gender5</ns2:Gender>
            <ns2:Email>Email6</ns2:Email>
            <ns2:UserName>UserName7</ns2:UserName>
            <ns2:Password>Password8</ns2:Password>
            <ns2:BirthDate>2014-10-27</ns2:BirthDate>
         </ns2:BasicInformation>
         <ns2:Address>
            <ns2:City>City9</ns2:City>
            <ns2:State>State10</ns2:State>
            <ns2:ZipCode>11</ns2:ZipCode>
         </ns2:Address>
         <ns2:CreditCard>
            <ns2:Number>Number12</ns2:Number>
            <ns2:CVV>13</ns2:CVV>
            <ns2:ExpirationDate>2014-10-27</ns2:ExpirationDate>
            <ns2:Type>Type14</ns2:Type>
         </ns2:CreditCard>
         <ns2:AditionalInfo>
            <ns2:Company>Company15</ns2:Company>
            <ns2:Vehicle>Vehicle16</ns2:Vehicle>
            <ns2:TelephoneNumber>TelephoneNumber17</ns2:TelephoneNumber>
         </ns2:AditionalInfo>
      </ns2:Customer>
      <ns2:Customer>
         <ns2:BasicInformation>
            <ns2:ID>18</ns2:ID>
            <ns2:Name>Name19</ns2:Name>
            <ns2:LastName>LastName20</ns2:LastName>
            <ns2:MiddleName>MiddleName21</ns2:MiddleName>
            <ns2:Gender>Gender22</ns2:Gender>
            <ns2:Email>Email23</ns2:Email>
            <ns2:UserName>UserName24</ns2:UserName>
            <ns2:Password>Password25</ns2:Password>
            <ns2:BirthDate>2014-10-27</ns2:BirthDate>
         </ns2:BasicInformation>
         <ns2:Address>
            <ns2:City>City26</ns2:City>
            <ns2:State>State27</ns2:State>
            <ns2:ZipCode>28</ns2:ZipCode>
         </ns2:Address>
         <ns2:CreditCard>
            <ns2:Number>Number29</ns2:Number>
            <ns2:CVV>30</ns2:CVV>
            <ns2:ExpirationDate>2014-10-27</ns2:ExpirationDate>
            <ns2:Type>Type31</ns2:Type>
         </ns2:CreditCard>
         <ns2:AditionalInfo>
            <ns2:Company>Company32</ns2:Company>
            <ns2:Vehicle>Vehicle33</ns2:Vehicle>
            <ns2:TelephoneNumber>TelephoneNumber34</ns2:TelephoneNumber>
         </ns2:AditionalInfo>
      </ns2:Customer>
      <ns2:Customer>
         <ns2:BasicInformation>
            <ns2:ID>35</ns2:ID>
            <ns2:Name>Name36</ns2:Name>
            <ns2:LastName>LastName37</ns2:LastName>
            <ns2:MiddleName>MiddleName38</ns2:MiddleName>
            <ns2:Gender>Gender39</ns2:Gender>
            <ns2:Email>Email40</ns2:Email>
            <ns2:UserName>UserName41</ns2:UserName>
            <ns2:Password>Password42</ns2:Password>
            <ns2:BirthDate>2014-10-27</ns2:BirthDate>
         </ns2:BasicInformation>
         <ns2:Address>
            <ns2:City>City43</ns2:City>
            <ns2:State>State44</ns2:State>
            <ns2:ZipCode>45</ns2:ZipCode>
         </ns2:Address>
         <ns2:CreditCard>
            <ns2:Number>Number46</ns2:Number>
            <ns2:CVV>47</ns2:CVV>
            <ns2:ExpirationDate>2014-10-27</ns2:ExpirationDate>
            <ns2:Type>Type48</ns2:Type>
         </ns2:CreditCard>
         <ns2:AditionalInfo>
            <ns2:Company>Company49</ns2:Company>
            <ns2:Vehicle>Vehicle50</ns2:Vehicle>
            <ns2:TelephoneNumber>TelephoneNumber51</ns2:TelephoneNumber>
         </ns2:AditionalInfo>
      </ns2:Customer>
   </ns2:Customers>
   <ns2:Errors>
      <vid:Error xmlns:vid="http://soa.grupovidanta.com/VidantaCommons/CustomerTestBiz">
         <vid:ErrorCode>ErrorCode52</vid:ErrorCode>
         <vid:Description>Description53</vid:Description>
         <vid:BusinessProcess>BusinessProcess54</vid:BusinessProcess>
         <vid:FailedService>FailedService55</vid:FailedService>
         <vid:TimeStamp>2014-10-27T18:05:06.226</vid:TimeStamp>
      </vid:Error>
      <vid:Error xmlns:vid="http://soa.grupovidanta.com/VidantaCommons/CustomerTestBiz">
         <vid:ErrorCode>ErrorCode56</vid:ErrorCode>
         <vid:Description>Description57</vid:Description>
         <vid:BusinessProcess>BusinessProcess58</vid:BusinessProcess>
         <vid:FailedService>FailedService59</vid:FailedService>
         <vid:TimeStamp>2014-10-27T18:05:06.226</vid:TimeStamp>
      </vid:Error>
      <vid:Error xmlns:vid="http://soa.grupovidanta.com/VidantaCommons/CustomerTestBiz">
         <vid:ErrorCode>ErrorCode60</vid:ErrorCode>
         <vid:Description>Description61</vid:Description>
         <vid:BusinessProcess>BusinessProcess62</vid:BusinessProcess>
         <vid:FailedService>FailedService63</vid:FailedService>
         <vid:TimeStamp>2014-10-27T18:05:06.227</vid:TimeStamp>
      </vid:Error>
   </ns2:Errors>
</ns2:FindCustomersRs>
